{"columns":282,"measuredRuns":[[234,19],[515,19],[797,12],[810,5],[1079,12],[1362,11],[1645,9],[1926,10],[2207,10],[2488,9],[2770,9],[3052,9],[3334,9],[3617,8],[3661,1],[3899,8],[3940,6],[4182,6],[4221,8],[4466,2],[4503,9],[4784,10],[5066,10],[5347,11],[5629,11],[5911,11],[6193,11],[6476,10],[6758,10],[7039,11],[7320,12],[7602,12],[7884,12],[8166,12],[8448,12],[8731,11],[9014,4],[9019,5],[9296,5],[9302,4],[9468,3],[9510,3],[9577,7],[9749,8],[9790,7],[9858,9],[10030,16],[10071,8],[10140,12],[10312,18],[10353,9],[10422,12],[10593,20],[10635,9],[10704,12],[10874,21],[10917,8],[10971,9],[10986,12],[11155,23],[11199,8],[11251,13],[11269,11],[11436,25],[11474,27],[11532,14],[11551,11],[11718,26],[11747,37],[11813,16],[11832,12],[11999,28],[12028,39],[12095,16],[12113,13],[12282,67],[12377,31],[12564,68],[12659,31],[12846,68],[12940,32],[13129,67],[13222,32],[13405,5],[13412,66],[13503,33],[13686,7],[13694,66],[13785,33],[13967,74],[14067,33],[14249,73],[14349,33],[14526,1],[14531,73],[14630,34],[14805,6],[14813,72],[14912,34],[15086,8],[15096,70],[15195,33],[15367,9],[15378,70],[15469,3],[15477,33],[15649,9],[15661,61],[15724,5],[15748,8],[15759,33],[15926,16],[15944,60],[16029,10],[16041,29],[16071,3],[16206,19],[16227,60],[16310,46],[16488,20],[16511,59],[16591,47],[16769,21],[16794,58],[16873,47],[17051,84],[17155,47],[17333,84],[17437,47],[17615,83],[17720,46],[17898,66],[17966,14],[18002,46],[18179,66],[18249,12],[18284,46],[18461,66],[18532,9],[18560,5],[18567,45],[18744,65],[18816,1],[18840,54],[19026,66],[19095,6],[19119,57],[19308,66],[19375,9],[19401,57],[19591,76],[19682,58],[19875,6],[19883,5],[19889,61],[19964,58],[20159,1],[20167,1],[20171,61],[20246,58],[20454,10],[20465,50],[20528,58],[20737,60],[20810,58],[21022,57],[21093,57],[21306,54],[21376,56],[21588,54],[21663,51],[21848,9],[21869,55],[21946,50],[22129,11],[22151,54],[22230,48],[22410,14],[22433,54],[22512,48],[22692,15],[22716,53],[22800,42],[22973,16],[22998,53],[23079,45],[23255,17],[23281,52],[23359,47],[23536,18],[23564,51],[23638,50],[23819,17],[23846,50],[23918,52],[24101,19],[24129,48],[24199,53],[24383,22],[24411,48],[24480,54],[24665,24],[24693,47],[24762,54],[24944,28],[24974,47],[25043,55],[25225,29],[25256,47],[25325,55],[25506,30],[25538,47],[25606,56],[25787,33],[25821,46],[25888,56],[26069,33],[26103,45],[26169,57],[26351,78],[26451,57],[26634,74],[26734,56],[26916,72],[26998,1],[27016,56],[27198,69],[27278,6],[27294,60],[27480,67],[27558,9],[27571,65],[27763,65],[27839,10],[27852,66],[28045,63],[28119,12],[28133,67],[28327,62],[28401,81],[28610,60],[28682,82],[28892,58],[28964,82],[29164,5],[29174,57],[29246,82],[29444,8],[29457,56],[29528,82],[29694,5],[29719,76],[29810,82],[29975,7],[30000,77],[30092,82],[30256,9],[30280,78],[30370,86],[30538,10],[30561,79],[30650,88],[30819,11],[30842,79],[30932,88],[31102,10],[31113,3],[31123,82],[31213,89],[31383,18],[31403,85],[31495,89],[31664,107],[31776,90],[31945,108],[32058,90],[32226,109],[32340,90],[32507,109],[32622,90],[32787,110],[32904,90],[33068,110],[33186,90],[33349,110],[33468,90],[33629,111],[33750,90],[33910,111],[34031,91],[34191,111],[34312,92],[34473,110],[34593,93],[34754,110],[34874,94],[35036,109],[35154,96],[35319,106],[35435,97],[35600,106],[35717,97],[35881,106],[35998,98],[36162,106],[36280,98],[36443,105],[36561,99],[36725,104],[36843,99],[37007,103],[37124,100],[37289,102],[37406,100],[37571,101],[37687,101],[37853,100],[37969,101],[38135,99],[38250,102],[38417,98],[38532,102],[38698,98],[38813,103],[38978,99],[39093,105],[39260,97],[39374,106],[39541,97],[39655,107],[39822,97],[39936,108],[40103,103],[40217,109],[40384,105],[40498,110],[40666,105],[40779,111],[40948,106],[41061,111],[41225,2],[41230,106],[41339,3],[41343,111],[41503,115],[41619,117],[41783,235],[42064,236],[42345,237],[42618,246],[42899,247],[43180,248],[43462,248],[43744,116],[43861,5],[43867,125],[44026,115],[44149,125],[44308,114],[44431,125],[44587,3],[44591,109],[44713,125],[44868,111],[44995,111],[45107,13],[45149,111],[45267,3],[45276,110],[45389,13],[45430,110],[45547,7],[45558,109],[45671,13],[45711,110],[45828,8],[45840,107],[45955,11],[45992,109],[46109,10],[46122,106],[46239,9],[46273,49],[46324,58],[46391,10],[46404,105],[46524,6],[46555,49],[46606,20],[46627,36],[46673,9],[46685,104],[46809,3],[46837,49],[46888,19],[46909,35],[46955,9],[46965,105],[47119,48],[47170,18],[47191,34],[47238,112],[47401,68],[47472,34],[47520,7],[47528,103],[47683,67],[47754,33],[47809,102],[47965,66],[48037,31],[48091,101],[48247,62],[48319,29],[48373,99],[48529,59],[48602,26],[48655,98],[48811,58],[48891,18],[48937,96],[49094,58],[49174,4],[49183,6],[49219,95],[49376,59],[49438,3],[49500,95],[49658,67],[49782,93],[49940,69],[50063,93],[50215,5],[50221,70],[50344,92],[50494,80],[50624,93],[50776,81],[50905,92],[51057,82],[51185,93],[51338,83],[51465,94],[51620,83],[51745,95],[51902,83],[52025,96],[52183,84],[52306,96],[52465,83],[52585,99],[52743,87],[52865,100],[53023,88],[53145,101],[53305,14],[53320,72],[53425,102],[53586,14],[53603,71],[53705,104],[53868,14],[53885,70],[53985,105],[54150,13],[54167,69],[54266,105],[54433,12],[54448,69],[54547,105],[54716,10],[54728,71],[54828,106],[55000,7],[55008,72],[55108,107],[55284,4],[55290,71],[55390,106],[55565,78],[55670,108],[55845,79],[55951,108],[56126,79],[56232,108],[56406,80],[56514,107],[56682,1],[56688,79],[56795,108],[56964,3],[56968,81],[57076,108],[57246,85],[57358,107],[57528,84],[57639,107],[57810,83],[57921,107],[58092,82],[58202,107],[58374,81],[58484,106],[58656,80],[58765,106],[58938,79],[59047,106],[59220,76],[59329,105],[59502,71],[59611,104],[59784,67],[59893,103],[60066,66],[60175,103],[60348,66],[60457,102],[60630,65],[60697,7],[60739,101],[60912,76],[61021,100],[61194,61],[61257,14],[61302,101],[61476,58],[61538,16],[61583,101],[61758,57],[61820,18],[61864,101],[62040,56],[62102,18],[62145,102],[62322,55],[62384,18],[62427,101],[62604,53],[62666,19],[62708,101],[62886,50],[62947,20],[62989,101],[63168,48],[63217,8],[63228,21],[63271,101],[63450,40],[63492,4],[63497,34],[63552,101],[63732,40],[63778,35],[63834,100],[64014,39],[64060,34],[64115,100],[64296,37],[64342,33],[64396,101],[64578,36],[64623,33],[64678,100]],"nodataSemantic":"water","rows":230,"schemaVersion":1}
